{
  "$schema": "https://raw.githubusercontent.com/furroxide/quantum-works/main/schemas/robotopia.mod.schema.json",
  "schemaVersion": 2,
  "name": "robotopia.sandbox",
  "displayName": "Sandbox",
  "version": "0.2.0",
  "author": {
    "name": "QuantumWorks"
  },
  "description": "The freeform creator sandbox, fleshed out: press Q for a spawn menu of the game's own UGC props and native robots (dormant statues or fully autonomous, talkable NPCs), undo with Z, freeze physics with F, and clean the whole stage with one confirmed click. Spawned props are real rigidbodies — grab and launch them with the Gravity Gun. Walk up to a dormant robot and PROGRAM it: talk (typed or push-to-talk voice) and it accepts a task — follow you, go to a marker, patrol — then leaves the chat to go do it. Runs on the Open Sandbox arena from Robotopia Worlds.",
  "entryAssembly": "Robotopia.Sandbox.dll",
  "entryType": "Robotopia.Sandbox.SandboxMod",
  "vpmDependencies": {
    "robotopia.worlds": ">=0.4.0",
    "robotopia.robotkit": ">=0.7.0"
  },
  "loadAfter": [
    "robotopia.worlds",
    "robotopia.robotkit",
    "robotopia.gravitygun"
  ],
  "supportedSdkVersionRange": ">=0.1.0 <0.2.0",
  "category": "Gameplay",
  "tags": [
    "sandbox",
    "gamemode",
    "spawn-menu",
    "props",
    "robots",
    "physics",
    "creative",
    "ai",
    "conversation",
    "objectives"
  ],
  "license": "Unspecified",
  "permissions": [
    "world-service",
    "robot-spawning",
    "input",
    "physics",
    "hud",
    "ai"
  ]
}
