{
  "$schema": "https://raw.githubusercontent.com/furroxide/quantum-works/main/schemas/robotopia.mod.schema.json",
  "schemaVersion": 2,
  "name": "robotopia.uigallery",
  "displayName": "QuantumWorks UI Gallery",
  "version": "0.1.0",
  "author": {
    "name": "QuantumWorks"
  },
  "description": "Developer tool: a living catalog of every QwUi widget in both brand schemes, with live high-contrast, UI-scale, and motion toggles. Toggle with F8. Not shipped in releases.",
  "entryAssembly": "Robotopia.UiGallery.dll",
  "entryType": "Robotopia.UiGallery.UiGalleryMod",
  "vpmDependencies": {},
  "supportedSdkVersionRange": ">=0.1.0 <0.2.0",
  "category": "DevTool",
  "tags": [
    "dev-only",
    "ui",
    "gallery",
    "sdk"
  ],
  "license": "Unspecified",
  "permissions": [
    "hud",
    "input"
  ]
}
