{
  "$schema": "https://raw.githubusercontent.com/furroxide/quantum-works/main/schemas/robotopia.mod.schema.json",
  "schemaVersion": 2,
  "name": "robotopia.prompts",
  "displayName": "Robotopia Prompts",
  "version": "0.1.0",
  "author": {
    "name": "QuantumWorks"
  },
  "description": "Framework SDK service for prompt override registration, deterministic effective override resolution, owner cleanup, disposable registrations, and conflict diagnostics.",
  "entryAssembly": "Robotopia.Prompts.dll",
  "entryType": "Robotopia.Prompts.PromptsMod",
  "vpmDependencies": {},
  "supportedGameVersionRange": "0.0.2227",
  "supportedLoaderVersionRange": ">=0.2.0 <0.3.0",
  "supportedSdkVersionRange": ">=0.1.0 <0.2.0",
  "category": "Framework",
  "tags": [
    "prompts",
    "overrides",
    "conflicts",
    "framework",
    "sdk"
  ],
  "license": "NOASSERTION",
  "permissions": [
    "prompt-overrides"
  ]
}
